{
  "kind": "modifier",
  "id": "rage-ember",
  "name": "Rage Ember",
  "status": "proposed",
  "source": "oni",
  "rarity": "common",
  "locked": true,
  "rules": [
    "A10",
    "A12",
    "A2",
    "A8",
    "A9",
    "E20",
    "T4"
  ],
  "applies_to": {
    "requires": []
  },
  "effects": [
    {
      "target": "damage",
      "op": "mul_pct",
      "value": 115,
      "when": "ryo_health_below_30pct"
    }
  ],
  "card": {
    "plain": "When you are badly hurt, the move burns hotter.",
    "frames": "+15% damage while Ryo is below 30% health"
  },
  "notes": "Condition reads Ryo's health only; the Tanuki's copy never gets modifiers (T4). Data only, no new animation (A10); visual is a preset reference for clip-matcher. Number from the rules.md modifiers table."
}
