{
  "kind": "modifier",
  "id": "cucumber-gift",
  "name": "Cucumber Gift",
  "status": "proposed",
  "source": "kappa",
  "rarity": "common",
  "locked": true,
  "rules": [
    "A10",
    "A12",
    "A2",
    "A8",
    "A9",
    "C1",
    "E20"
  ],
  "applies_to": {
    "requires": []
  },
  "effects": [
    {
      "target": "heal_pct_max_health",
      "op": "add",
      "value": 2,
      "when": "on_hit"
    }
  ],
  "card": {
    "plain": "A kappa's cucumber gift heals you a little when the move hits.",
    "frames": "Heals 2% of max health on hit"
  },
  "notes": "Max health is Ryo's 1,000 (C1), so 20 health per hit. Data only, no new animation (A10); visual is a preset reference for clip-matcher. Number from the rules.md modifiers table."
}
